{
  "$schema": "./fill-auth.schema.json",
  "description": "EIP-712 FillAuth(bytes32 fillId,address filler,address to,address token,uint256 amount,uint256 deadline) vectors for RiddlerFiller (ESCROW-RFC §9.4). signer_private_key values are PUBLIC Hardhat/Anvil TEST keys: never fund or register them.",
  "domain": {
    "name": "RiddlerFiller",
    "version": "1"
  },
  "typehash": "0xa5a56c32ac0c4e7a32f827a6e2d80d369d1beb5bf1e8cd51c3addf571dd2727e",
  "vectors": [
    {
      "name": "baseline-base",
      "chainId": "8453",
      "verifyingContract": "0x4444444444444444444444444444444444444444",
      "fillId": "0x9b60bd754be9ae37355883c28726578ab823340a2e56e4ea9a23dfa6277de66b",
      "filler": "0x70997970C51812dc3A010C7d01b50e0d17dc79C8",
      "to": "0x3C44CdDdB6a900fa2b585dd299e03d12FA4293BC",
      "token": "0x833589fCD6eDb6E08f4c7C32D4f71b54bdA02913",
      "amount": "1000000",
      "deadline": "1900000000",
      "expected_struct_hash": "0x84f895e7066d6c35cae7eb1dfe8086676b52c6f24ebcc88a5a945ccc27c7a87e",
      "expected_domain_separator": "0xc4525d261cfdfa05e297777bf9e1cc5d93ba9054592134a5369b1dd2e937b0b1",
      "expected_digest": "0x78a60889a7a4acae3b76e52ff83dccc56413f559f37252b95bf32b9271b8b90a",
      "signer_private_key": "0xac0974bec39a17e36ba4a6b4d238ff944bacb478cbed5efcae784d7bf4f2ff80",
      "signer_address": "0xf39Fd6e51aad88F6F4ce6aB8827279cffFb92266",
      "expected_signature": "0x39c9501102d232fcf6e4896e9aa4cbe1d79bba2bb282f7e2c699b10696032b71009f687c72cdc7f978192f1f215f6e2275eb68a25de70b3422b62a6491ff85851c"
    },
    {
      "name": "second-signer",
      "chainId": "8453",
      "verifyingContract": "0x4444444444444444444444444444444444444444",
      "fillId": "0x9b60bd754be9ae37355883c28726578ab823340a2e56e4ea9a23dfa6277de66b",
      "filler": "0x70997970C51812dc3A010C7d01b50e0d17dc79C8",
      "to": "0x3C44CdDdB6a900fa2b585dd299e03d12FA4293BC",
      "token": "0x833589fCD6eDb6E08f4c7C32D4f71b54bdA02913",
      "amount": "1000000",
      "deadline": "1900000000",
      "expected_struct_hash": "0x84f895e7066d6c35cae7eb1dfe8086676b52c6f24ebcc88a5a945ccc27c7a87e",
      "expected_domain_separator": "0xc4525d261cfdfa05e297777bf9e1cc5d93ba9054592134a5369b1dd2e937b0b1",
      "expected_digest": "0x78a60889a7a4acae3b76e52ff83dccc56413f559f37252b95bf32b9271b8b90a",
      "signer_private_key": "0x59c6995e998f97a5a0044966f0945389dc9e86dae88c7a8412f4603b6b78690d",
      "signer_address": "0x70997970C51812dc3A010C7d01b50e0d17dc79C8",
      "expected_signature": "0x69d97b77150e7f17558a608a1a1e3f74820f54621326e5cbcab913721e56a77c1051a8ae515bd9ed4914ab712115f597d320e326884adeb2965c2ab4e08ef2c61b"
    },
    {
      "name": "other-chain-and-filler",
      "chainId": "1",
      "verifyingContract": "0x9A676e781A523b5d0C0e43731313A708CB607508",
      "fillId": "0x9b60bd754be9ae37355883c28726578ab823340a2e56e4ea9a23dfa6277de66b",
      "filler": "0x70997970C51812dc3A010C7d01b50e0d17dc79C8",
      "to": "0x3C44CdDdB6a900fa2b585dd299e03d12FA4293BC",
      "token": "0xA0b86991c6218b36c1d19D4a2e9Eb0cE3606eB48",
      "amount": "1000000",
      "deadline": "1900000000",
      "expected_struct_hash": "0xf83c9df2e47c6596b4e7ce69260768b06e47743537960477a68ce0f7085febc7",
      "expected_domain_separator": "0x3267a22c62454104f6c7183e0c74a46a63f8bed9555e177978379ac80777b75c",
      "expected_digest": "0x318b0287bf0e6018b4aac1b5dd2bebc715cd5d272a8967ad9683203a3786839a",
      "signer_private_key": "0xac0974bec39a17e36ba4a6b4d238ff944bacb478cbed5efcae784d7bf4f2ff80",
      "signer_address": "0xf39Fd6e51aad88F6F4ce6aB8827279cffFb92266",
      "expected_signature": "0x603638cce395d9fc8459f190703bb5bf2254cf428d82f40f78654c7f4a5440e237b8e7d58df99360ce74bd73c59c7fea9e8aaefc7488ef89ba0b8784a80f99ad1c"
    },
    {
      "name": "zero-amount-zero-deadline",
      "chainId": "8453",
      "verifyingContract": "0x4444444444444444444444444444444444444444",
      "fillId": "0x0000000000000000000000000000000000000000000000000000000000000001",
      "filler": "0x70997970C51812dc3A010C7d01b50e0d17dc79C8",
      "to": "0x3C44CdDdB6a900fa2b585dd299e03d12FA4293BC",
      "token": "0x833589fCD6eDb6E08f4c7C32D4f71b54bdA02913",
      "amount": "0",
      "deadline": "0",
      "expected_struct_hash": "0x22c3293917ec653fe157fb560888a4b62d5c26a8dd699be2663c176adf8bc928",
      "expected_domain_separator": "0xc4525d261cfdfa05e297777bf9e1cc5d93ba9054592134a5369b1dd2e937b0b1",
      "expected_digest": "0x844414d24b9b369e0d92b645c32ef45085e371623abe5afcda0ab612c4b582e5",
      "signer_private_key": "0xac0974bec39a17e36ba4a6b4d238ff944bacb478cbed5efcae784d7bf4f2ff80",
      "signer_address": "0xf39Fd6e51aad88F6F4ce6aB8827279cffFb92266",
      "expected_signature": "0x15135f1d0ab22e8f19b541f48fe3188938b6eed16876125cb6a438e5afab26d07530833df15c257e0f5779f617bc67702b4b1131d0938bea627de7c236107dfc1c"
    },
    {
      "name": "max-uint256-amount-and-deadline",
      "chainId": "42161",
      "verifyingContract": "0x4444444444444444444444444444444444444444",
      "fillId": "0xffffffffffffffffffffffffffffffffffffffffffffffffffffffffffffffff",
      "filler": "0xFFfFfFffFFfffFFfFFfFFFFFffFFFffffFfFFFfF",
      "to": "0x3C44CdDdB6a900fa2b585dd299e03d12FA4293BC",
      "token": "0x833589fCD6eDb6E08f4c7C32D4f71b54bdA02913",
      "amount": "115792089237316195423570985008687907853269984665640564039457584007913129639935",
      "deadline": "115792089237316195423570985008687907853269984665640564039457584007913129639935",
      "expected_struct_hash": "0x4eab50322d11d71e963681b0ff4ed94c51b718a4d9493f310a7d1a51c6d393c8",
      "expected_domain_separator": "0x94ce09905defe908038f4a9693800648657caf80a2d675b3b69b353e60af4c31",
      "expected_digest": "0xa6be026faa681af34039c0f401df5c157df234e93a7fe948fb6e603a15fc2c0f",
      "signer_private_key": "0x59c6995e998f97a5a0044966f0945389dc9e86dae88c7a8412f4603b6b78690d",
      "signer_address": "0x70997970C51812dc3A010C7d01b50e0d17dc79C8",
      "expected_signature": "0x606754331f6a1ed9e6687ac9b3d96258fc9cf5a7cd08cc0310f6ce48c3225a2841dab80e23e0d68604a4f8fc4a9cc60dc07f2c92515f563788e4affafeb3b8ba1c"
    }
  ]
}
